{
  "schema_version": "retrieval_quality_plan_v1",
  "plan_id": "cp04-public-catalog-quality-v1",
  "status": "design_frozen_execution_pending",
  "frozen_at": "2026-09-12T00:00:00Z",
  "evidence_owner": "quality_evaluator",
  "acceptance_owner": "product_planner",
  "pins": {
    "catalog_snapshot_id": "catalog-v5.1-2026-09-01-d2acb067017707bf6a01fcdfcedf1cc5324719acc7648b449980a5d4cecb371e",
    "source_sha256": "d2acb067017707bf6a01fcdfcedf1cc5324719acc7648b449980a5d4cecb371e",
    "cards_sha256": "fceeaa7eaf1d83e280ed4244fed2717a820d59fcdc5b1aa849fd82f245f2ef5b",
    "index_sha256": "acc1ddba2945c4ce2014178d61d923419f4d569a6ae77629790b8e7adbdab9c7",
    "policy_sha256": "ff6e8444c4664492bb099f0819b2d284aa5c28f0d44c7a745c63f434c3489dbf",
    "taxonomy_sha256": "09dcaac99e1e1d7110e9ab64ef33e20654be225fb6ea81dc5bfbf3483f3a721f",
    "card_schema_version": "2.0.0",
    "activity_schema_version": "2.0.0",
    "index_format_version": 2,
    "retrieval_policy_version": "2.1.0",
    "corpus_kind": "catalog_snapshot"
  },
  "artifacts": {
    "manifest_path": "plugins/myai-stackguide/assets/catalog.search-manifest.json",
    "manifest_sha256": "9cbb259aac4c75707814a3eb4f6811214146539d13a36f32aaae9e2ef072f8c8",
    "cards_path": "plugins/myai-stackguide/assets/catalog.snapshot.json",
    "index_path": "plugins/myai-stackguide/assets/catalog.search.sqlite",
    "policy_path": "plugins/myai-stackguide/assets/retrieval-policy.json",
    "catalog_row_count": 2500
  },
  "rubric_sha256": "96f67da80234d4ade36c9b5e5fb50276398acce76751513e9e041926b74f3fef",
  "candidate_route": {
    "source_mode": "catalog_only",
    "retrieval_engine": "sqlite_fts5",
    "query_schema_version": "2.0.0",
    "expected_status": "ok",
    "max_query_variants": 3,
    "max_terms_per_variant": 8,
    "max_candidates": 150,
    "max_cards": 12,
    "max_evidence_bytes": 163840,
    "whole_catalog_prompt_fallback": false
  },
  "default_constraints": {
    "visibility": "public",
    "availability": "available",
    "archived": false,
    "unknown_mandatory_fact": "reference_with_verification"
  },
  "split_policy": {
    "development_count": 12,
    "held_out_count": 12,
    "freeze_before_capture": true,
    "held_out_tuning_forbidden": true,
    "adjudication": "source_reviewed_public_card_facts_not_runtime_output_labels"
  },
  "lexical_baseline": {
    "baseline_id": "literal-field-or-v1",
    "normalization": "unicode_nfkc_casefold",
    "operator": "OR",
    "match": "normalized_literal_substring_per_declared_field",
    "score": "count_distinct_query_term_field_pairs",
    "tie_breaker": "github_repository_id_ascending",
    "constraints": "same_predeclared_case_constraints_for_baseline_and_candidate",
    "candidate_limit": 150,
    "comparison_rule": "same_frozen_cases_judgments_k_and_pins"
  },
  "thresholds": {
    "held_out_macro_recall_at_12_min": 0.75,
    "held_out_macro_ndcg_at_12_min": 0.65,
    "candidate_not_worse_than_baseline_recall_delta_min": 0.0,
    "candidate_not_worse_than_baseline_ndcg_delta_min": 0.0,
    "required_stratum_recall_at_12_min": 0.6,
    "required_stratum_ndcg_at_12_min": 0.5,
    "hard_constraint_violations_max": 0,
    "false_exclusions_max": 0,
    "duplicate_canonical_ids_max": 0,
    "alias_success_rate_min": 1.0,
    "evidence_pack_survival_rate_min": 0.9,
    "container_route_coverage_min": 14,
    "leaf_route_coverage_min": 111,
    "human_total_min": 16,
    "human_critical_dimension_min": 1,
    "human_critical_failures_max": 0,
    "actual_warm_p95_ms_max": 100,
    "actual_cold_p95_ms_max": 250,
    "synthetic_warm_p95_ms_max": 200,
    "synthetic_cold_p95_ms_max": 500,
    "peak_memory_bytes_max": 268435456,
    "index_bytes_max": 67108864
  },
  "stratification": {
    "container_ids": [
      "developer_tools_cli_general",
      "testing_qa",
      "files_media_storage",
      "frontend_frameworks_ui",
      "accounting_finance_erp",
      "cms_content_knowledge",
      "communications_personal_ops",
      "ecommerce_payments_revenue",
      "operations_project_management",
      "data_ingestion_etl_cdc",
      "databases_storage_caching",
      "backend_baas_api",
      "deployment_containers_paas",
      "supply_chain_devsecops"
    ],
    "leaf_route_count": 111,
    "thin_leaf_max_cards": 10,
    "dense_leaf_min_cards": 30,
    "required_case_tags": [
      "thin_leaf",
      "dense_leaf",
      "baseline_cohort",
      "expansion_cohort",
      "historical_alias",
      "dual_descriptions",
      "secondary_dedupe",
      "container_union",
      "lexical_ru",
      "lexical_en",
      "activity_unknown"
    ]
  },
  "scale_protocol": {
    "actual": {
      "corpus_kind": "catalog_snapshot",
      "row_count": 2500,
      "purpose": "Capacity, measured latency/memory/bytes and relevance only after actual CP-11 captures use these exact pins and complete judgments.",
      "quality_claim_allowed": false,
      "repetitions": 30
    },
    "headroom": {
      "corpus_kind": "synthetic_headroom",
      "row_count": 10000,
      "purpose": "Deterministic headroom only; repeated or generated rows cannot prove relevance, catalog growth or product usefulness.",
      "quality_claim_allowed": false,
      "repetitions": 30
    },
    "measurement": {
      "cold_definition": "New read-only process and SQLite connection for each sample; OS cache state is recorded rather than claimed flushed.",
      "warm_definition": "Same read-only process and immutable index after one discarded warm-up query; no index writes or rebuild.",
      "latency_percentiles": ["p50", "p95"],
      "memory_method_required": true,
      "hardware_runtime_required": true,
      "serialized_bytes_required": true
    }
  },
  "language_protocol": {
    "lexical_locales": ["en", "ru"],
    "presentation_locales": ["ru", "en"],
    "same_canonical_capture": true,
    "presentation_switch_calls": [],
    "preserve": ["canonical_ids", "candidate_order", "constraints", "roles", "evidence_refs", "negation", "uncertainty", "execution_authority"]
  },
  "human_protocol": {
    "reviewers": ["quality_evaluator", "product_planner"],
    "independent_first_pass": true,
    "adjudicate_disagreement": true,
    "same_canonical_capture_for_locales": true,
    "required_artifacts": ["canonical capture hash", "source/index/policy versions and hashes", "baseline and candidate records", "paired RU/EN projections", "dimension scores with evidence", "critical-failure checklist", "accepted gaps and reviewer identities"],
    "quality_observed": false
  },
  "cases": [
    {
      "case_id": "CP04-DEV-01", "split": "development", "requirement_ids": ["R06", "R12"], "persona": "developer",
      "synthetic_project_context": "Synthetic local developer-tool project; no private source or identifier.", "user_goal": "Choose an extensible terminal editor.",
      "query_locale": "en", "query_terms": ["extensible", "editor"], "target_category_id": "editors_ides", "container_domain_ids": ["developer_tools_cli_general"],
      "leaf_card_count": 6, "leaf_band": "thin", "tags": ["thin_leaf", "baseline_cohort", "container_union", "lexical_en", "dual_descriptions"],
      "expected_match_routes": ["upstream_description", "catalog_description", "category_labels"], "expected_alias": null,
      "judgment_pool_ids": [16408992, 40997482], "expected_relevant_ids": [16408992, 40997482],
      "judgments": [
        {"github_repository_id": 16408992, "full_name": "neovim/neovim", "primary_category_id": "editors_ides", "membership_cohort": "baseline", "grade": 3, "constraint": "allowed", "rationale": "The pinned public card classifies Neovim as a code editor and describes extensibility."},
        {"github_repository_id": 40997482, "full_name": "vim/vim", "primary_category_id": "editors_ides", "membership_cohort": "baseline", "grade": 2, "constraint": "allowed", "rationale": "The pinned public card places Vim in the same editor leaf as a useful alternative."}
      ], "k": 12, "accepted_gaps": ["No CP-09/CP-11 retrieval capture or human recommendation result exists."]
    },
    {
      "case_id": "CP04-DEV-02", "split": "development", "requirement_ids": ["R06", "R12"], "persona": "backend engineer",
      "synthetic_project_context": "Synthetic Java API project with no private data.", "user_goal": "Find an API mock server by its historical repository name.",
      "query_locale": "en", "query_terms": ["mock-server/mockserver"], "target_category_id": "api_contract_testing", "container_domain_ids": ["testing_qa"],
      "leaf_card_count": 10, "leaf_band": "thin", "tags": ["thin_leaf", "baseline_cohort", "container_union", "historical_alias", "lexical_en"],
      "expected_match_routes": ["historical_alias", "category_labels"], "expected_alias": "mock-server/mockserver",
      "judgment_pool_ids": [8426406, 2544305], "expected_relevant_ids": [8426406, 2544305],
      "judgments": [
        {"github_repository_id": 8426406, "full_name": "mock-server/mockserver-monorepo", "primary_category_id": "api_contract_testing", "membership_cohort": "baseline", "grade": 3, "constraint": "allowed", "rationale": "The exact historical alias is retained on the pinned API-contract-testing card."},
        {"github_repository_id": 2544305, "full_name": "wiremock/wiremock", "primary_category_id": "api_contract_testing", "membership_cohort": "baseline", "grade": 2, "constraint": "allowed", "rationale": "WireMock is source-classified in the same API and contract testing leaf."}
      ], "k": 12, "accepted_gaps": ["Alias retrieval is a future observed route; this freezes the expected judgment only."]
    },
    {
      "case_id": "CP04-DEV-03", "split": "development", "requirement_ids": ["R06", "R12"], "persona": "media operator",
      "synthetic_project_context": "Synthetic self-hosted photo-library context.", "user_goal": "Evaluate a self-hosted photo library.",